{
  "specversion": "1.0",
  "id": "00000000-0000-4000-8000-000000000004",
  "source": "urn:todolima:fixture:phase0",
  "type": "com.hazlocrecer.site-snapshot.created.v1",
  "subject": "snapshot-golden-001",
  "time": "2026-09-29T12:00:00Z",
  "datacontenttype": "application/json",
  "dataschema": "https://schemas.hazlocrecer.com/events/site-snapshot.created.schema.json",
  "correlationid": "golden-flow-001",
  "causationid": "00000000-0000-4000-8000-000000000003",
  "businessid": "golden-business-synthetic-001",
  "data": {
    "schema_version": "0.1.0",
    "artifact_hash": "40f90690f8869f703783ae40d0d738ec9d0c03ceadd2500d96486abb1d9a49ef",
    "document": {
      "schema_version": "0.1.0",
      "snapshot_id": "snapshot-golden-001",
      "site_id": "site-golden-001",
      "business_id": "golden-business-synthetic-001",
      "site_config_hash": "033d138b425a5e2742581e87e51e039dcb1add211d1dabcecad50650519bd438",
      "truth_snapshot": {
        "business_truth_version": "0.1.0",
        "content_hash": "de59f2135a5fa19bcd08b136d23574bd46a8e056098891f3d0e7b09526227e87"
      },
      "brand_profile": {
        "brand_profile_id": "brand-golden-001",
        "content_hash": "65de06ec581ebdf5a44f2bebb4dd7f0b1f4c896f0ccc1e8d28e1e88fe114366b"
      },
      "recipe": {
        "recipe_id": "generic-information",
        "recipe_version": "0.1.0",
        "content_hash": "692aef5fea2a7263d122ecfb5a6ec1cd697b002f4653bc4fc8eb850fdbb3b414"
      },
      "mode": "demo",
      "indexing": "noindex",
      "build": {
        "build_id": "fixture-build-001",
        "engine_version": "static-fixture-0.1.0",
        "created_at": "2026-09-29T12:00:00Z"
      },
      "entrypoint": "index.html",
      "artifacts": [
        {
          "path": "index.html",
          "media_type": "text/html",
          "sha256": "cbdcbe35d82114e725ce66ff4b961ef0637197a62be8b7fadebd67f74458da9f",
          "bytes": 462
        }
      ],
      "qa": {
        "status": "not_run",
        "report_ref": null
      },
      "publication": {
        "status": "not_published",
        "url": null
      }
    }
  }
}
